{
  "contract_version": "cad-roof-calculation-request/0.1",
  "roof_type": "gable",
  "footprint": {
    "outer_ring_mm": [[0, 0], [12000, 0], [12000, 8000], [0, 8000]]
  },
  "parameters": {
    "pitch_deg": 35,
    "eaves_height_mm": 6000,
    "ridge_direction": "auto",
    "overhang_mm": {
      "default_mm": 500,
      "north_mm": 700,
      "south_mm": 700,
      "east_mm": 400,
      "west_mm": 400
    },
    "roof_skin_thickness_mm": 180,
    "roof_skin_material": "vp.roof.tiled-insulated",
    "structure": {
      "rafter": {"width_mm": 80, "height_mm": 220, "spacing_mm": 700},
      "purlin": {"width_mm": 160, "height_mm": 240, "maximum_spacing_mm": 2500}
    }
  }
}
